{
  "event_type": "RepoBugReported.v1",
  "event_version": "v1",
  "process_slug": "sample-process",
  "city_pair_slug": "sample-process-exec-codegen",
  "source_city": "sample-execution-monitoring-city-dev",
  "source_city_role": "execution-monitoring-city",
  "target_city": "sample-code-generation-city-dev",
  "target_city_role": "code-generation-city",
  "correlation_id": "11111111-1111-4111-8111-111111111111",
  "idempotency_key": "sample-process:sample-process-exec-codegen:RepoBugReported.v1:run-42:build-validation-regression",
  "occurred_at": "2026-06-04T12:00:00Z",
  "payload": {
    "repo": "sample-runtime",
    "target_branch": "main",
    "severity": "high",
    "observed_behavior": "build validation fails for item 42 with a null tier on the registry join",
    "expected_behavior": "validation passes; tier is resolved from the identity registry",
    "reproduction_steps": [
      "trigger execution run for item 42 through the configured orchestrator",
      "observe ExecutionValidationFailed.v1 with null-tier error in the run manifest"
    ],
    "failing_command": "gc bridge run build --item 42",
    "evidence_uris": [
      "s3://gascity-artifacts-dev/executions/run-42/manifest.json",
      "s3://gascity-artifacts-dev/executions/run-42/validation.json"
    ]
  }
}
